Welcome to Address Book!


--------------------
#UC1 CREATE DATABASE
---------------------
CREATE database address_book;
mysql> show databases;
+--------------------+
| Database           |
+--------------------+
| address_book       |
| information_schema |
| mysql              |
| payroll_service    |
| performance_schema |
| sys                |
+--------------------+
6 rows in set (0.05 sec)


-----------------------
 #UC2 CREATE DATABASE 
-----------------------

mysql> CREATE TABLE address_book
    -> (
    -> first_name VARCHAR(100) NOT NULL,
    -> last_name  VARCHAR(100) NOT NULL,
    -> address    VARCHAR(100) NOT NULL,
    -> city       VARCHAR(100) NOT NULL,
    -> state      VARCHAR(100) NOT NULL,
    -> zip        INT UNSIGNED NOT NULL,
    -> phonenumber BIGINT NOT NULL,
    -> email_id   VARCHAR(300) NOT NULL
    -> );
Query OK, 0 rows affected (2.07 sec)


------------------------------------
 #UC3 ADD DATA TO THE ADDRESS BOOK
------------------------------------
mysql> INSERT INTO address_book (first_name,last_name,address,city,state,zip,phonenumber,email_id)
    -> VALUES('Gagan','Reddy','Heelalige','Bangalore','KA','560099','8722289619','gaganreddy30@gmail.com');
Query OK, 1 row affected (0.22 sec)

mysql> SELECT * FROM address_book;
+------------+-----------+-----------+-----------+-------+--------+-------------+------------------------+
| first_name | last_name | address   | city      | state | zip    | phonenumber | email_id               |
+------------+-----------+-----------+-----------+-------+--------+-------------+------------------------+
| Gagan      | Reddy     | Heelalige | Bangalore | KA    | 560099 |  8722289619 | gaganreddy30@gmail.com |
+------------+-----------+-----------+-----------+-------+--------+-------------+------------------------+
1 row in set (0.33 sec)

mysql> INSERT INTO address_book (first_name,last_name,address,city,state,zip,phonenumber,email_id)
    -> VALUES('Shravya','Reddy','Hosur','Chennai','TN','635109','7019329791','shravyareddy@gmail.com');
Query OK, 1 row affected (0.39 sec)

mysql> SELECT * FROM address_book;
+------------+-----------+-----------+-----------+-------+--------+-------------+------------------------+
| first_name | last_name | address   | city      | state | zip    | phonenumber | email_id               |
+------------+-----------+-----------+-----------+-------+--------+-------------+------------------------+
| Gagan      | Reddy     | Heelalige | Bangalore | KA    | 560099 |  8722289619 | gaganreddy30@gmail.com |
| Shravya    | Reddy     | Hosur     | Chennai   | TN    | 635109 |  7019329791 | shravyareddy@gmail.com |
+------------+-----------+-----------+-----------+-------+--------+-------------+------------------------+
2 rows in set (0.00 sec)

-------------------------------------
#UC4 EDIT CONTACT USING NAME
-------------------------------------

UPDATE address_book set phonenumber = 9901014451
    -> WHERE first_name = 'shravya' AND last_name = 'Reddy';
Query OK, 1 row affected (0.39 sec)
Rows matched: 1  Changed: 1  Warnings: 0

----------------------------------
#UC5 DELETE PERSON USING NAME
----------------------------------
mysql> Delete from address_book
    -> WHERE first_name = 'shravya' AND last_name = 'Reddy';
Query OK, 1 row affected (0.13 sec)

mysql> SELECT * FROM address_book;
+------------+-----------+-----------+-----------+-------+--------+-------------+------------------------+
| first_name | last_name | address   | city      | state | zip    | phonenumber | email_id               |
+------------+-----------+-----------+-----------+-------+--------+-------------+------------------------+
| Gagan      | Reddy     | Heelalige | Bangalore | KA    | 560099 |  8722289619 | gaganreddy30@gmail.com |
+------------+-----------+-----------+-----------+-------+--------+-------------+------------------------+
1 row in set (0.05 sec)

-----------------------------------------------
#UC6 Retrive person belongs to city are State 
-----------------------------------------------
mysql> SELECT * FROM address_book
    -> where state ='TN' OR city ='Chennai';
+------------+-----------+---------+---------+-------+--------+-------------+------------------------+
| first_name | last_name | address | city    | state | zip    | phonenumber | email_id               |
+------------+-----------+---------+---------+-------+--------+-------------+------------------------+
| Shravya    | Reddy     | Hosur   | Chennai | TN    | 635109 |  7019329791 | shravyareddy@gmail.com |
+------------+-----------+---------+---------+-------+--------+-------------+------------------------+
1 row in set (0.00 sec)

-----------------------------------------------------
#UC7 UNDERSTAND SIZE OF ADDRESS BOOK BY CITY AND STATE
-------------------------------------------------------

mysql> USE address_book;
Database changed
mysql> SELECT city,COUNT(*) FROM address_book;
+-----------+----------+
| city      | COUNT(*) |
+-----------+----------+
| Bangalore |        3 |
+-----------+----------+
1 row in set (0.07 sec)

mysql> USE address_book;
Database changed
mysql> SELECT city,COUNT(*) FROM address_book
    -> GROUP BY city;
+------------+----------+
| city       | COUNT(*) |
+------------+----------+
| Bangalore  |        1 |
| Chennai    |        1 |
| Ahmednagar |        1 |
+------------+----------+
3 rows in set (0.00 sec)

mysql> SELECT state,COUNT(*) FROM address_book
    -> GROUP BY state;
+-------+----------+
| state | COUNT(*) |
+-------+----------+
| KA    |        1 |
| TN    |        1 |
| MH    |        1 |
+-------+----------+
3 rows in set (0.00 sec) 
------------------------------------------------------------------
#UC8 RETRIVE ENTRIES STORED ALPHABETICALLY BY NAME FOR GIVEN CITY
------------------------------------------------------------------
mysql> USE address_book;
Database changed
mysql> SELECT * FROM address_book
    -> Where city ="Bangalore"
    -> ORDER BY first_name ASC;
+------------+-----------+-----------+-----------+-------+--------+-------------+------------------------+
| first_name | last_name | address   | city      | state | zip    | phonenumber | email_id               |
+------------+-----------+-----------+-----------+-------+--------+-------------+------------------------+
| Gagan      | Reddy     | Heelalige | Bangalore | KA    | 560099 |  8722289619 | gaganreddy30@gmail.com |
+------------+-----------+-----------+-----------+-------+--------+-------------+------------------------+
1 row in set (0.80 sec)


------------------------------------------------------------------
#UC9 IDENTIFY EACH ADDRESS BOOK BY NAME AND TYPE [FAMILY,FRINDS]
------------------------------------------------------------------
mysql> ALTER TABLE address_book
    -> ADD type VARCHAR(150) AFTER last_name;
Query OK, 0 rows affected (6.38 sec)
Records: 0  Duplicates: 0  Warnings: 0

mysql> UPDATE address_book SET type = 'family'
    -> WHERE first_name = 'Gagan' OR first_name = 'Shravya';
Query OK, 2 rows affected (0.26 sec)
Rows matched: 2  Changed: 2  Warnings: 0

mysql> SELECT * FROM address_book;
+------------+-----------+--------+-----------+------------+-------+--------+-------------+------------------------+
| first_name | last_name | type   | address   | city       | state | zip    | phonenumber | email_id               |
+------------+-----------+--------+-----------+------------+-------+--------+-------------+------------------------+
| Gagan      | Reddy     | family | Heelalige | Bangalore  | KA    | 560099 |  8722289619 | gaganreddy30@gmail.com |
| Shravya    | Reddy     | family | Hosur     | Chennai    | TN    | 635109 |  7019329791 | shravyareddy@gmail.com |
| Dilip      | Gowda     | NULL   | shirdi    | Ahmednagar | MH    | 423107 |  9739303032 | Dilipgowda@gmail.com   |
+------------+-----------+--------+-----------+------------+-------+--------+-------------+------------------------+
3 rows in set (0.04 sec)

mysql> UPDATE address_book SET type = 'friends'
    -> WHERE first_name = 'Dilip' OR last_name = 'Reddy';
Query OK, 3 rows affected (0.16 sec)
Rows matched: 3  Changed: 3  Warnings: 0

mysql> SELECT * FROM address_book;
+------------+-----------+---------+-----------+------------+-------+--------+-------------+------------------------+
| first_name | last_name | type    | address   | city       | state | zip    | phonenumber | email_id               |
+------------+-----------+---------+-----------+------------+-------+--------+-------------+------------------------+
| Gagan      | Reddy     | friends | Heelalige | Bangalore  | KA    | 560099 |  8722289619 | gaganreddy30@gmail.com |
| Shravya    | Reddy     | friends | Hosur     | Chennai    | TN    | 635109 |  7019329791 | shravyareddy@gmail.com |
| Dilip      | Gowda     | friends | shirdi    | Ahmednagar | MH    | 423107 |  9739303032 | Dilipgowda@gmail.com   |
+------------+-----------+---------+-----------+------------+-------+--------+-------------+------------------------+
3 rows in set (0.04 sec)

mysql> UPDATE address_book SET type = 'manager'
    -> WHERE first_name = 'Dilip' OR last_name = 'Gowda';
Query OK, 1 row affected (0.08 sec)
Rows matched: 1  Changed: 1  Warnings: 0

mysql> SELECT * FROM address_book;
+------------+-----------+---------+-----------+------------+-------+--------+-------------+------------------------+
| first_name | last_name | type    | address   | city       | state | zip    | phonenumber | email_id               |
+------------+-----------+---------+-----------+------------+-------+--------+-------------+------------------------+
| Gagan      | Reddy     | friends | Heelalige | Bangalore  | KA    | 560099 |  8722289619 | gaganreddy30@gmail.com |
| Shravya    | Reddy     | friends | Hosur     | Chennai    | TN    | 635109 |  7019329791 | shravyareddy@gmail.com |
| Dilip      | Gowda     | manager | shirdi    | Ahmednagar | MH    | 423107 |  9739303032 | Dilipgowda@gmail.com   |
+------------+-----------+---------+-----------+------------+-------+--------+-------------+------------------------+
3 rows in set (0.00 sec)

---------------------------------------------
#UC10 GET NO OF CONTACT PERSON COUNT BY TYPE
---------------------------------------------
mysql> USE address_book;
Database changed
mysql> SELECT type,COUNT(*) from address_book
    -> GROUP BY type;
+---------+----------+
| type    | COUNT(*) |
+---------+----------+
| friends |        2 |
| manager |        1 |
+---------+----------+
2 rows in set (0.24 sec)

---------------------------------------------------
#UC11 ABILITY TO ADD PERSON BOTH FRINDS AND FAMILY
--------------------------------------------------


mysql> UPDATE address_book SET type = 'friends'
    -> WHERE first_name = 'Gagan' OR last_name ='Gowda';
Query OK, 1 row affected (0.30 sec)
Rows matched: 2  Changed: 1  Warnings: 0

mysql> select * from address_book;
+------------+-----------+---------+-----------+------------+-------+--------+-------------+------------------------+
| first_name | last_name | type    | address   | city       | state | zip    | phonenumber | email_id               |
+------------+-----------+---------+-----------+------------+-------+--------+-------------+------------------------+
| Gagan      | Reddy     | friends | Heelalige | Bangalore  | KA    | 560099 |  8722289619 | gaganreddy30@gmail.com |
| Shravya    | Reddy     | friends | Hosur     | Chennai    | TN    | 635109 |  7019329791 | shravyareddy@gmail.com |
| Dilip      | Gowda     | friends | shirdi    | Ahmednagar | MH    | 423107 |  9739303032 | Dilipgowda@gmail.com   |
+------------+-----------+---------+-----------+------------+-------+--------+-------------+------------------------+
3 rows in set (0.00 sec)

mysql> UPDATE address_book SET type = 'manager'
    -> WHERE first_name = 'Gagan';
Query OK, 1 row affected (0.12 sec)
Rows matched: 1  Changed: 1  Warnings: 0

mysql> select * from address_book;
+------------+-----------+---------+-----------+------------+-------+--------+-------------+------------------------+
| first_name | last_name | type    | address   | city       | state | zip    | phonenumber | email_id               |
+------------+-----------+---------+-----------+------------+-------+--------+-------------+------------------------+
| Gagan      | Reddy     | manager | Heelalige | Bangalore  | KA    | 560099 |  8722289619 | gaganreddy30@gmail.com |
| Shravya    | Reddy     | friends | Hosur     | Chennai    | TN    | 635109 |  7019329791 | shravyareddy@gmail.com |
| Dilip      | Gowda     | friends | shirdi    | Ahmednagar | MH    | 423107 |  9739303032 | Dilipgowda@gmail.com   |
+------------+-----------+---------+-----------+------------+-------+--------+-------------+------------------------+
3 rows in set (0.04 sec)

-----------------------------------------------------------------
	   UC12 RE-CREATING TABLES TO DRAW ER-DIAGRAM
-------------------------------------------------------------------
mysql> use address_book;
Database changed
mysql> create table name_type
    -> (
    -> id int not null auto_increment,
    -> name varchar(150) not null,
    -> type varchar(100) not null,
    -> primary key(id)
    -> );
Query OK, 0 rows affected (1.92 sec)

mysql> desc name_type;
+-------+--------------+------+-----+---------+----------------+
| Field | Type         | Null | Key | Default | Extra          |
+-------+--------------+------+-----+---------+----------------+
| id    | int          | NO   | PRI | NULL    | auto_increment |
| name  | varchar(150) | NO   |     | NULL    |                |
| type  | varchar(100) | NO   |     | NULL    |                |
+-------+--------------+------+-----+---------+----------------+
3 rows in set (0.07 sec)

mysql> insert into name_type (name,type)
    -> select name,type from address_book;
ERROR 1054 (42S22): Unknown column 'name' in 'field list'
mysql> insert into name_type (name,type)
    -> select name , type from address_book;
ERROR 1054 (42S22): Unknown column 'name' in 'field list'
mysql> select  type from address_book;
+---------+
| type    |
+---------+
| manager |
| friends |
| friends |
+---------+
3 rows in set (0.03 sec)

mysql> insert into name_type (name,type)
    -> select name from address_book;
ERROR 1054 (42S22): Unknown column 'name' in 'field list'
mysql> create table id_name
    -> (
    -> id int not null auto_increment,
    -> name varchar(300) not null,
    -> primary key(id)
    -> );
Query OK, 0 rows affected (1.05 sec)

mysql> show tables;
+------------------------+
| Tables_in_address_book |
+------------------------+
| address_book           |
| id_name                |
| name_type              |
+------------------------+
3 rows in set (0.11 sec)

mysql> desc id_name;
+-------+--------------+------+-----+---------+----------------+
| Field | Type         | Null | Key | Default | Extra          |
+-------+--------------+------+-----+---------+----------------+
| id    | int          | NO   | PRI | NULL    | auto_increment |
| name  | varchar(300) | NO   |     | NULL    |                |
+-------+--------------+------+-----+---------+----------------+
2 rows in set (0.41 sec)

mysql> insert into id_name (name)
    -> select name from address_book;
ERROR 1054 (42S22): Unknown column 'name' in 'field list'
mysql> insert into id_name (name)
    -> select first_ name from address_book;
ERROR 1054 (42S22): Unknown column 'first_' in 'field list'
mysql> insert into id_name (name)
    -> select first_name from address_book;
Query OK, 3 rows affected (0.64 sec)
Records: 3  Duplicates: 0  Warnings: 0

mysql> create table id_type
    -> (
    -> id int not null auto_increment,
    -> type varchar(100) not null,
    -> primary key(id)
    -> );
Query OK, 0 rows affected (1.39 sec)

mysql> insert into id_type (type)
    -> select type from address_book;
Query OK, 3 rows affected (0.17 sec)
Records: 3  Duplicates: 0  Warnings: 0

mysql> select * from id_type;
+----+---------+
| id | type    |
+----+---------+
|  1 | manager |
|  2 | friends |
|  3 | friends |
+----+---------+
3 rows in set (0.00 sec)

mysql> ALTER TABLE id_type CHANGE id type_id int not null auto_increment;
Query OK, 0 rows affected (0.14 sec)
Records: 0  Duplicates: 0  Warnings: 0

mysql> select * from id_type;
+---------+---------+
| type_id | type    |
+---------+---------+
|       1 | manager |
|       2 | friends |
|       3 | friends |
+---------+---------+
3 rows in set (0.00 sec)

mysql> update id_type set type = 'family'
    -> where type_id = 2;
Query OK, 1 row affected (0.06 sec)
Rows matched: 1  Changed: 1  Warnings: 0

mysql> delete from id_type
    -> where type_id = 3 or type_id = 4 or type_id = 5;
Query OK, 1 row affected (0.13 sec)

mysql> select * from id_type;
+---------+---------+
| type_id | type    |
+---------+---------+
|       1 | manager |
|       2 | family  |
+---------+---------+
2 rows in set (0.08 sec)

mysql> create table id_city
    -> (
    -> city_id int not null auto_increment,
    -> city varchar(150) not null,
    -> primary key(city_id)
    -> );
Query OK, 0 rows affected (1.51 sec)

mysql> show tables;
+------------------------+
| Tables_in_address_book |
+------------------------+
| address_book           |
| id_city                |
| id_name                |
| id_type                |
| name_type              |
+------------------------+
5 rows in set (0.03 sec)

mysql> desc id_city;
+---------+--------------+------+-----+---------+----------------+
| Field   | Type         | Null | Key | Default | Extra          |
+---------+--------------+------+-----+---------+----------------+
| city_id | int          | NO   | PRI | NULL    | auto_increment |
| city    | varchar(150) | NO   |     | NULL    |                |
+---------+--------------+------+-----+---------+----------------+
2 rows in set (0.32 sec)

mysql> insert into id_city (city)
    -> select city from address_book;
Query OK, 3 rows affected (0.55 sec)
Records: 3  Duplicates: 0  Warnings: 0

mysql> select * from id_city;
+---------+------------+
| city_id | city       |
+---------+------------+
|       1 | Bangalore  |
|       2 | Chennai    |
|       3 | Ahmednagar |
+---------+------------+
3 rows in set (0.00 sec)

mysql> delete from id_city
    -> where city_id = 2 or city_id = 3;
Query OK, 2 rows affected (0.14 sec)

mysql> update id_city set city_id = 2
    -> where city = 'Nellur';
Query OK, 0 rows affected (0.00 sec)
Rows matched: 0  Changed: 0  Warnings: 0

mysql> update id_city set city_id = 3
    -> where city = 'Vijayavada';
Query OK, 0 rows affected (0.00 sec)
Rows matched: 0  Changed: 0  Warnings: 0

mysql> select * from id_city;
+---------+-----------+
| city_id | city      |
+---------+-----------+
|       1 | Bangalore |
+---------+-----------+
1 row in set (0.04 sec)

mysql> create table id_state
    -> (
    -> state_id int not null auto_increment,
    -> state varchar(150) not null,
    -> primary key(state_id)
    -> );
Query OK, 0 rows affected (1.35 sec)

mysql> show tables;
+------------------------+
| Tables_in_address_book |
+------------------------+
| address_book           |
| id_city                |
| id_name                |
| id_state               |
| id_type                |
| name_type              |
+------------------------+
6 rows in set (0.06 sec)

mysql> desc id_state;
+----------+--------------+------+-----+---------+----------------+
| Field    | Type         | Null | Key | Default | Extra          |
+----------+--------------+------+-----+---------+----------------+
| state_id | int          | NO   | PRI | NULL    | auto_increment |
| state    | varchar(150) | NO   |     | NULL    |                |
+----------+--------------+------+-----+---------+----------------+
2 rows in set (0.01 sec)

mysql> insert into id_state (state)
    -> select state from address_book;
Query OK, 3 rows affected (0.23 sec)
Records: 3  Duplicates: 0  Warnings: 0

mysql> select * from id_state;
+----------+-------+
| state_id | state |
+----------+-------+
|        1 | KA    |
|        2 | TN    |
|        3 | MH    |
+----------+-------+
3 rows in set (0.00 sec)

mysql> delete from id_state
    -> where state_id = 2 or state_id = 3 or state_id = 5;
Query OK, 2 rows affected (0.10 sec)

mysql> update id_state set state_id = 2
    -> where state = 'Andhra Pradesh';
Query OK, 0 rows affected (0.00 sec)
Rows matched: 0  Changed: 0  Warnings: 0

mysql> select * from id_state;
+----------+-------+
| state_id | state |
+----------+-------+
|        1 | KA    |
+----------+-------+
1 row in set (0.00 sec)

mysql> create table city_zip
    -> (
    -> id int not null auto_increment,
    -> city varchar(150) not null,
    -> zip int not null,
    -> primary key(id)
    -> );
Query OK, 0 rows affected (0.95 sec)

mysql> show tables;
+------------------------+
| Tables_in_address_book |
+------------------------+
| address_book           |
| city_zip               |
| id_city                |
| id_name                |
| id_state               |
| id_type                |
| name_type              |
+------------------------+
7 rows in set (0.00 sec)

mysql> desc city_zip;
+-------+--------------+------+-----+---------+----------------+
| Field | Type         | Null | Key | Default | Extra          |
+-------+--------------+------+-----+---------+----------------+
| id    | int          | NO   | PRI | NULL    | auto_increment |
| city  | varchar(150) | NO   |     | NULL    |                |
| zip   | int          | NO   |     | NULL    |                |
+-------+--------------+------+-----+---------+----------------+
3 rows in set (0.00 sec)

mysql> insert into city_zip (city,zip)
    -> select city,zip from address_book;
Query OK, 3 rows affected (0.14 sec)
Records: 3  Duplicates: 0  Warnings: 0

mysql> select * from city_zip;
+----+------------+--------+
| id | city       | zip    |
+----+------------+--------+
|  1 | Bangalore  | 560099 |
|  2 | Chennai    | 635109 |
|  3 | Ahmednagar | 423107 |
+----+------------+--------+
3 rows in set (0.00 sec)

mysql> delete from city_zip
    -> where id = 2 or id = 3;
Query OK, 2 rows affected (0.45 sec)

mysql> update city_zip set id = 2
    -> where city = 'Nellur';
Query OK, 0 rows affected (0.00 sec)
Rows matched: 0  Changed: 0  Warnings: 0

mysql> update city_zip set id = 3
    -> where city = 'Vijayavada';
Query OK, 0 rows affected (0.00 sec)
Rows matched: 0  Changed: 0  Warnings: 0

mysql> select * from city_zip;
+----+-----------+--------+
| id | city      | zip    |
+----+-----------+--------+
|  1 | Bangalore | 560099 |
+----+-----------+--------+
1 row in set (0.00 sec)

mysql> create table id_details
    -> (
    -> id int not null auto_increment,
    -> first_name varchar(150) not null,
    -> last_name varchar(150) not null,
    -> email varchar(300) not null,
    -> primary key(id)
    -> );
Query OK, 0 rows affected (1.87 sec)

mysql> show tables;
+------------------------+
| Tables_in_address_book |
+------------------------+
| address_book           |
| city_zip               |
| id_city                |
| id_details             |
| id_name                |
| id_state               |
| id_type                |
| name_type              |
+------------------------+
8 rows in set (0.38 sec)

mysql> desc id_details;
+------------+--------------+------+-----+---------+----------------+
| Field      | Type         | Null | Key | Default | Extra          |
+------------+--------------+------+-----+---------+----------------+
| id         | int          | NO   | PRI | NULL    | auto_increment |
| first_name | varchar(150) | NO   |     | NULL    |                |
| last_name  | varchar(150) | NO   |     | NULL    |                |
| email      | varchar(300) | NO   |     | NULL    |                |
+------------+--------------+------+-----+---------+----------------+
4 rows in set (0.07 sec)

mysql> select first_name,last_name,email_id from address_book;
+------------+-----------+------------------------+
| first_name | last_name | email_id               |
+------------+-----------+------------------------+
| Gagan      | Reddy     | gaganreddy30@gmail.com |
| Shravya    | Reddy     | shravyareddy@gmail.com |
| Dilip      | Gowda     | Dilipgowda@gmail.com   |
+------------+-----------+------------------------+
3 rows in set (0.01 sec)

mysql> select * from id_details;
Empty set (0.00 sec)

mysql> create table id_phonenumber
    -> (
    -> id int not null auto_increment,
    -> phonenumber bigint not null,
    -> primary key(id)
    -> );
Query OK, 0 rows affected (0.69 sec)

mysql> show tables;
+------------------------+
| Tables_in_address_book |
+------------------------+
| address_book           |
| city_zip               |
| id_city                |
| id_details             |
| id_name                |
| id_phonenumber         |
| id_state               |
| id_type                |
| name_type              |
+------------------------+
9 rows in set (0.07 sec)

mysql> desc id_phonenumber;
+-------------+--------+------+-----+---------+----------------+
| Field       | Type   | Null | Key | Default | Extra          |
+-------------+--------+------+-----+---------+----------------+
| id          | int    | NO   | PRI | NULL    | auto_increment |
| phonenumber | bigint | NO   |     | NULL    |                |
+-------------+--------+------+-----+---------+----------------+
2 rows in set (0.13 sec)

mysql> insert into id_phonenumber (phonenumber)
    -> select phonenumber from address_book;
Query OK, 3 rows affected (0.48 sec)
Records: 3  Duplicates: 0  Warnings: 0

mysql> select * from id_phonenumber;
+----+-------------+
| id | phonenumber |
+----+-------------+
|  1 |  8722289619 |
|  2 |  7019329791 |
|  3 |  9739303032 |
+----+-------------+
3 rows in set (0.00 sec)