Welcome to Address Book!


--------------------
#UC1 CREATE DATABASE
---------------------
CREATE database address_book;
mysql> show databases;
+--------------------+
| Database           |
+--------------------+
| address_book       |
| information_schema |
| mysql              |
| payroll_service    |
| performance_schema |
| sys                |
+--------------------+
6 rows in set (0.05 sec)


-----------------------
 #UC2 CREATE DATABASE 
-----------------------

mysql> CREATE TABLE address_book
    -> (
    -> first_name VARCHAR(100) NOT NULL,
    -> last_name  VARCHAR(100) NOT NULL,
    -> address    VARCHAR(100) NOT NULL,
    -> city       VARCHAR(100) NOT NULL,
    -> state      VARCHAR(100) NOT NULL,
    -> zip        INT UNSIGNED NOT NULL,
    -> phonenumber BIGINT NOT NULL,
    -> email_id   VARCHAR(300) NOT NULL
    -> );
Query OK, 0 rows affected (2.07 sec)


------------------------------------
 #UC3 ADD DATA TO THE ADDRESS BOOK
------------------------------------
mysql> INSERT INTO address_book (first_name,last_name,address,city,state,zip,phonenumber,email_id)
    -> VALUES('Gagan','Reddy','Heelalige','Bangalore','KA','560099','8722289619','gaganreddy30@gmail.com');
Query OK, 1 row affected (0.22 sec)

mysql> SELECT * FROM address_book;
+------------+-----------+-----------+-----------+-------+--------+-------------+------------------------+
| first_name | last_name | address   | city      | state | zip    | phonenumber | email_id               |
+------------+-----------+-----------+-----------+-------+--------+-------------+------------------------+
| Gagan      | Reddy     | Heelalige | Bangalore | KA    | 560099 |  8722289619 | gaganreddy30@gmail.com |
+------------+-----------+-----------+-----------+-------+--------+-------------+------------------------+
1 row in set (0.33 sec)

mysql> INSERT INTO address_book (first_name,last_name,address,city,state,zip,phonenumber,email_id)
    -> VALUES('Shravya','Reddy','Hosur','Chennai','TN','635109','7019329791','shravyareddy@gmail.com');
Query OK, 1 row affected (0.39 sec)

mysql> SELECT * FROM address_book;
+------------+-----------+-----------+-----------+-------+--------+-------------+------------------------+
| first_name | last_name | address   | city      | state | zip    | phonenumber | email_id               |
+------------+-----------+-----------+-----------+-------+--------+-------------+------------------------+
| Gagan      | Reddy     | Heelalige | Bangalore | KA    | 560099 |  8722289619 | gaganreddy30@gmail.com |
| Shravya    | Reddy     | Hosur     | Chennai   | TN    | 635109 |  7019329791 | shravyareddy@gmail.com |
+------------+-----------+-----------+-----------+-------+--------+-------------+------------------------+
2 rows in set (0.00 sec)

-------------------------------------
#UC4 EDIT CONTACT USING NAME
-------------------------------------

UPDATE address_book set phonenumber = 9901014451
    -> WHERE first_name = 'shravya' AND last_name = 'Reddy';
Query OK, 1 row affected (0.39 sec)
Rows matched: 1  Changed: 1  Warnings: 0

----------------------------------
#UC5 DELETE PERSON USING NAME
----------------------------------
mysql> Delete from address_book
    -> WHERE first_name = 'shravya' AND last_name = 'Reddy';
Query OK, 1 row affected (0.13 sec)

mysql> SELECT * FROM address_book;
+------------+-----------+-----------+-----------+-------+--------+-------------+------------------------+
| first_name | last_name | address   | city      | state | zip    | phonenumber | email_id               |
+------------+-----------+-----------+-----------+-------+--------+-------------+------------------------+
| Gagan      | Reddy     | Heelalige | Bangalore | KA    | 560099 |  8722289619 | gaganreddy30@gmail.com |
+------------+-----------+-----------+-----------+-------+--------+-------------+------------------------+
1 row in set (0.05 sec)

-----------------------------------------------
#UC6 Retrive person belongs to city are State 
-----------------------------------------------
mysql> SELECT * FROM address_book
    -> where state ='TN' OR city ='Chennai';
+------------+-----------+---------+---------+-------+--------+-------------+------------------------+
| first_name | last_name | address | city    | state | zip    | phonenumber | email_id               |
+------------+-----------+---------+---------+-------+--------+-------------+------------------------+
| Shravya    | Reddy     | Hosur   | Chennai | TN    | 635109 |  7019329791 | shravyareddy@gmail.com |
+------------+-----------+---------+---------+-------+--------+-------------+------------------------+
1 row in set (0.00 sec)

-----------------------------------------------------
#UC7 UNDERSTAND SIZE OF ADDRESS BOOK BY CITY AND STATE
-------------------------------------------------------

mysql> USE address_book;
Database changed
mysql> SELECT city,COUNT(*) FROM address_book;
+-----------+----------+
| city      | COUNT(*) |
+-----------+----------+
| Bangalore |        3 |
+-----------+----------+
1 row in set (0.07 sec)

mysql> USE address_book;
Database changed
mysql> SELECT city,COUNT(*) FROM address_book
    -> GROUP BY city;
+------------+----------+
| city       | COUNT(*) |
+------------+----------+
| Bangalore  |        1 |
| Chennai    |        1 |
| Ahmednagar |        1 |
+------------+----------+
3 rows in set (0.00 sec)

mysql> SELECT state,COUNT(*) FROM address_book
    -> GROUP BY state;
+-------+----------+
| state | COUNT(*) |
+-------+----------+
| KA    |        1 |
| TN    |        1 |
| MH    |        1 |
+-------+----------+
3 rows in set (0.00 sec) 